{
  "task_packet_id": "3fa85f64-5717-4562-b3fc-2c963f66afa6",
  "schema_version": "1.0.0",
  "status": "PENDING",
  "task_type": "CODEGEN",
  "title": "Implement tolerance helper",
  "objective": "Add pure function for stack-up with explicit unit handling.",
  "input_artifact_refs": ["artifact://requirements_set/x"],
  "required_outputs": [{ "artifact_type": "CODE_PATCH", "schema_version": "1.0.0" }],
  "acceptance_criteria": ["Unit tests cover nominal and worst-case stack."],
  "budget_policy": { "allow_escalation": false },
  "routing_metadata": {
    "requested_by": "control_plane",
    "selected_executor": "coding_model",
    "reason": "golden_fixture",
    "router_policy_version": "1"
  },
  "provenance": { "source_stage": "task_generation" },
  "created_at": "2026-04-07T12:00:00Z",
  "updated_at": "2026-04-07T12:00:00Z"
}
